{
  "manifest_id": "QB-PHYSICS-COMPETITIVE-PASS1-V2",
  "version": "2.5.0",
  "acquisition_ref": "PASS1-OFFICIAL-ARCHIVE-2026-09-23",
  "target_package": "Physics/library/exam-bank/competitive-exam-question-bank.v2.json",
  "inspector_id": "pass1-provenance",
  "inspection_sections": [
    "IIT-JEE 2007 Paper I Physics Q3",
    "IIT-JEE 2007 Paper I Physics Q10",
    "IIT-JEE 2008 Paper II Physics Q33",
    "IIT-JEE 2011 Paper I Physics Q41",
    "IIT-JEE 2011 Paper II Physics Q34",
    "JEE (Advanced) 2014 Paper 2 Physics Q19",
    "JEE (Advanced) 2020 Paper 1 Physics Q13",
    "IIT-JEE 2011 Paper II Physics Q33",
    "JEE (Advanced) 2018 Paper 2 Physics Q8",
    "JEE (Advanced) 2019 Paper 2 Physics Q9",
    "JEE (Advanced) 2021 Paper 1 Physics Q5",
    "JEE (Advanced) 2021 Paper 1 Physics Q6",
    "JEE (Advanced) 2024 Paper 2 Physics Q9",
    "IIT-JEE 2008 Paper II Physics Q32",
    "JEE (Advanced) 2014 Paper 1 Physics Q18",
    "IIT-JEE 2012 Paper I Physics Q5",
    "JEE (Advanced) 2014 Paper 1 Physics Q8",
    "NEET (UG) 2020 English Set E1 Physics Q160",
    "JEE (Advanced) 2022 Paper 1 Physics Q8",
    "JEE (Advanced) 2023 Paper 1 Physics Q1",
    "JEE (Advanced) 2025 Paper 2 Physics Q15",
    "IIT-JEE 2009 Paper I Physics Q49",
    "IIT-JEE 2009 Paper II Physics Q40",
    "IIT-JEE 2009 Paper II Physics Q55",
    "IIT-JEE 2011 Paper II Physics Q26",
    "JEE (Advanced) 2014 Paper 1 Physics Q11",
    "JEE (Advanced) 2026 Paper 1 Physics Q6",
    "JEE (Advanced) 2013 Paper 1 Physics Q7"
  ],
  "access_status": "FULL_ITEM_INSPECTED",
  "resource": {
    "id": "SRC-JEEADV-OFFICIAL-ARCHIVE",
    "version": "1.0.0",
    "status": "REVIEWED",
    "source_refs": [],
    "evidence_refs": [],
    "extensions": {
      "grade9v3:authority_class": "OFFICIAL_EXAM_ORGANIZER_ARCHIVE"
    },
    "title": "JEE (Advanced) official past question-paper archive",
    "origin": "WEB",
    "locator": "https://jeeadv.ac.in/archive.html",
    "edition": "2007-2026 papers inspected for PASS 1",
    "section": "Selected official prior papers",
    "last_checked": "2026-09-23",
    "access_status": "SECTION_INSPECTED",
    "rights_status": "Official organizer archive. Exact source wording and figures remain at organizer paper locators; learner-usable records here are explicitly faithful non-verbatim PYQ_ADAPTED restatements.",
    "snapshot_ref": null,
    "snapshot_digest": null,
    "role": [
      "QUESTION_BANK"
    ],
    "supports_claims": [],
    "entry_capabilities": [],
    "depth": [
      "ADVANCED"
    ],
    "selection_reason": "Primary authoritative source used to verify historical exam identity and question locators.",
    "fallback": []
  },
  "extensions": {
    "grade9v3:pass_scope": "PASS_1_QUESTION_BANK_ONLY",
    "grade9v3:generated_sets": false,
    "grade9v3:source_hint_policy": "question.hints[] is source custody only; authored support is question.scaffolds[].",
    "grade9v3:wording_policy": "Every learner-facing stem is PYQ_ADAPTED because it is a faithful non-verbatim restatement; the verified original identity remains in grade9v3:source_custody.",
    "grade9v3:topic_counts": {
      "Newton's Laws of Motion / NLM": 13,
      "Motion in 2D / Motion in a Plane — linear/projectile only": 15,
      "Motion in 1D — relative motion only": 3
    },
    "grade9v3:source_resource_policy": "Question source_refs/origin_ref resolve against resources[]; exact source wording remains external.",
    "grade9v3:accepted_question_count": 31
  },
  "questions": [
    {
      "id": "PYQ-PHY-IITJEE-2007-P1-Q03",
      "version": "2.0.0",
      "status": "CANDIDATE",
      "source_refs": [
        "SRC-JEEADV-OFFICIAL-ARCHIVE"
      ],
      "evidence_refs": [],
      "extensions": {
        "grade9v3:provenance_class": "PYQ_ADAPTED",
        "grade9v3:source_custody": {
          "authority_class": "OFFICIAL_EXAM_ORGANIZER_ARCHIVE",
          "exam": "IIT-JEE",
          "year": 2007,
          "paper": "Paper I",
          "section": "Physics",
          "question_number": "3",
          "paper_url": "https://jeeadv.ac.in/past_qps/2007_1.pdf",
          "archive_url": "https://jeeadv.ac.in/archive.html",
          "answer_key_url": null,
          "answer_authority": "OFFICIAL_PAPER_EMBEDDED_KEY",
          "last_checked": "2026-09-23",
          "source_status": "PYQ_VERIFIED_PARENT",
          "parent_ref": "IIT-JEE|2007|Paper I|Physics|Q3",
          "wording_custody": "FAITHFUL_NON_VERBATIM_RESTATEMENT"
        },
        "grade9v3:analysis": {
          "topic": "Newton's Laws of Motion / NLM",
          "concept_bucket": "BUCKET-PHY-NLM-FIRST-LAW",
          "exam_source_badge": "IIT-JEE 2007 · Paper I · Q3",
          "original_question_type": "single_correct_mcq",
          "learner_question_type": "single_correct_mcq",
          "difficulty": {
            "band": "D3",
            "score": 6,
            "components": {
              "concept_model_selection": 2,
              "representation_translation": 2,
              "reasoning_chain_length": 1,
              "algebra_computational_load": 1,
              "trap_exception_sensitivity": 0
            },
            "basis": "Changing string geometry must be translated into tension components before Newton II is applied."
          },
          "expected_time_seconds": 180,
          "common_wrong_route": "Taking T=F/2 without resolving the angled string segments.",
          "stable_crux_move": "Determine the tension from the massless midpoint geometry before applying Newton II to a mass.",
          "transfer_profile": {
            "core2b_candidate": false,
            "dimension": null,
            "classification": "SAME_FAMILY_VARIATION"
          }
        },
        "grade9v3:math_spans": [
          {
            "target": "option:0",
            "literal": "sqrt(a^2-x^2)",
            "tex": "\\sqrt{a^{2}-x^{2}}",
            "display": false
          },
          {
            "target": "option:1",
            "literal": "sqrt(a^2-x^2)",
            "tex": "\\sqrt{a^{2}-x^{2}}",
            "display": false
          },
          {
            "target": "option:3",
            "literal": "sqrt(a^2-x^2)",
            "tex": "\\sqrt{a^{2}-x^{2}}",
            "display": false
          },
          {
            "target": "answer_reasoning:0",
            "literal": "x^2",
            "tex": "x^{2}",
            "display": false
          },
          {
            "target": "answer_reasoning:0",
            "literal": "y^2",
            "tex": "y^{2}",
            "display": false
          },
          {
            "target": "answer_reasoning:0",
            "literal": "a^2",
            "tex": "a^{2}",
            "display": false
          },
          {
            "target": "answer_reasoning:0",
            "literal": "sqrt(a^2-x^2)",
            "tex": "\\sqrt{a^{2}-x^{2}}",
            "display": false
          },
          {
            "target": "answer_reasoning:2",
            "literal": "sqrt(a^2-x^2)",
            "tex": "\\sqrt{a^{2}-x^{2}}",
            "display": false
          },
          {
            "target": "answer_summary",
            "literal": "a_mass",
            "tex": "a_{mass}",
            "display": false
          },
          {
            "target": "answer_summary",
            "literal": "sqrt(a^2-x^2)",
            "tex": "\\sqrt{a^{2}-x^{2}}",
            "display": false
          }
        ]
      },
      "origin": "ADAPTED",
      "origin_ref": "SRC-JEEADV-OFFICIAL-ARCHIVE",
      "original_identifier": "IIT-JEE|2007|Paper I|Physics|Q3",
      "stem": "Two equal masses m lie on a smooth horizontal surface and are joined by a light string of total length 2a. The midpoint of the initially taut string is pulled vertically upward by a small constant force F. When the masses are separated by 2x, determine the magnitude of the acceleration of either mass.",
      "subparts": [],
      "options": [
        "(A) (F/2m)·a/sqrt(a^2-x^2)",
        "(B) (F/2m)·x/sqrt(a^2-x^2)",
        "(C) (F/2m)·x/a",
        "(D) (F/2m)·sqrt(a^2-x^2)/x"
      ],
      "conditions": [
        "Horizontal surface is frictionless.",
        "String is light and remains taut.",
        "Each half-string has length a."
      ],
      "figure_refs": [],
      "answer": {
        "kind": "MODEL_RESPONSE",
        "summary": "Option (B): a_mass = F x / [2m sqrt(a^2-x^2)].",
        "reasoning": [
          "Let the midpoint rise by y. String geometry gives x^2 + y^2 = a^2, so y = sqrt(a^2-x^2).",
          "At the massless midpoint, vertical force balance gives 2T(y/a)=F, hence T=Fa/(2y).",
          "The horizontal force on either mass is T(x/a), so its acceleration is F x/[2m sqrt(a^2-x^2)]."
        ],
        "reasoning_route": [
          {
            "id": "PYQ-PHY-IITJEE-2007-P1-Q03-MOVE-1",
            "kind": "REPRESENT",
            "action": "Let the midpoint rise by y. String geometry gives x^2 + y^2 = a^2, so y = sqrt(a^2-x^2).",
            "why_valid": "This follows from the stated physical or chemical model and the quantities preserved in the source-matched task.",
            "inputs": [
              "stated source quantities"
            ],
            "output": "intermediate result 1"
          },
          {
            "id": "PYQ-PHY-IITJEE-2007-P1-Q03-MOVE-2",
            "kind": "CONNECT",
            "action": "At the massless midpoint, vertical force balance gives 2T(y/a)=F, hence T=Fa/(2y).",
            "why_valid": "This follows from the stated physical or chemical model and the quantities preserved in the source-matched task.",
            "inputs": [
              "stated source quantities"
            ],
            "output": "intermediate result 2"
          },